Why is your VAT ridiculous now and why do you KEEP on raising my bill. I'm going to be paying £45 a month at this rate for a rubbish phone,1
My grip is the broadband I have with them the service could be better I've been with O2 a few years and you don't get anything for loyalty,1
Have moved from Vodafone after ten years (ouch!) as O2 offered a good deal and Vodafone couldnt match it. Have so far been pleasantly surprised.,1
"We have a couple of iPhones and Blackberries with O2. The service is usually problem free, but we find that 3G coverage is really hit and miss.",1
Very limited 4g coverage in central london and surrounding areas.  Vodafone was much better.O2 priority makes it just about worthwhile.,1
"The website was a nightmare to use for me after mix up with my details left me with 2 different online 'identities' attached to one phone number, causing problems every time I tried to log in.  This left me no option but to call the customer service line, who were unable to help me on the numerous occasions when I called to discuss the problem.  I am not so unreasonable as I don't understand that problems occur, however I found o2's response (or lack thereof) very disappointing, especially because I had previously been very happy with my o2 tariff.  However a good tariff isn't everything, the customer support needs to be good too. I have now moved my custom to Vodafone, who have been much easier to deal with (so far) - As an (almost comical) post-script to the entire business, o2 then erroneously deducted a further, dd payment after my last bill date; they have since apologised and refunded but it certainly didn't improve my opinion of them.",1
"At first I gave it 1 star, though it is what it is. Which is a simple app. Nothing great and nothing awful.",1
"PAYG mobile ... cannot log in and they cannot find my number even though I use it regularly, 3 weeks ago I needed a separate mobile broadband sim while changing broadband suppliers, set up account and log in a week later to check my usage not a problem, 3 weeks later tried to log in again and they cannot find my broadband number so I cannot access my account and they cannot find my e mail address yet they are sending me e mails quoting last 4 digits of my broadband number, absolute mess and pointless trying to phone as no one answering, should have stuck with EEOriginal review was 1 star however having failed get in touch with anyone on the phone I filled in a complaint form and the matter was sorted within 24 hours so fair is fair and I have upgraded the review to 3 stars as the matter was sorted, I haven’t made it 5 stars as the problem should never have happened in the first place and there was no explanation or apology for the problems caused. Perhaps they should also open up an e mail help line for non urgent matters and save people hanging on an unanswered phone line. Just a thought.",1
"I'm not sure there's much to choose between mobile phone businesses. For every bad experience, there's a good 'un, snuck away somewhere...or maybe people only moan these days. My phone deal was up and not gonna' lie, I hate when that happens. A morass of offers and sheer confusion, lies ahead. Got a phone deal from BuyMobiles (they were easy to deal with and the phone arrived next day). However, I needed to tidy up the old O2 deal and retain the number. Step up Kirsty Fairbrother! A voice on the phone, from sunny St Helens. Super efficient, super friendly and nothing a problem. Explained, sorted...bish, bash and most certainly, bosh. 5 stars for Kirsty. So why 3 stars overall? That's just for O2. Crap upgrade offer. Live chat only, as outside our 'normal hours', I'd be dealing with someone (nice as they are) in Manila, or some such and a website that seems to be unreachable, on more occasions than should be the case, for a tech business. Well, I have my phone, I have a great deal and I had a Kirsty on my side...everyone should have a Kirsty on their side...",1
"Signal is awful, monthly contract prices are criminal but they're the best of a bad bunch.",1
I often loose signals on O2. I previously used Vodafone and never experienced any problems. Its not that bad but not that good either.,1
"I was with O2 for almost five years, and I was very reluctant to leave. I wanted to upgrade my phone to the HTC Sensation at the end of my contract, but the offer online was much more expensive than offers I had found elsewhere so I gave them a ring.The lady who I spoke to was really unhelpful, and told me that they wouldn't be selling the sensation for long as it was an old model (which is rubbish), and offered me an even older model stating that this would match the price of the offers I had found!Eventually after speaking to about 4 different people, all of whom give me various rubbish answers and not one of them tried to keep me as a customer, I decided to leave. It then took me another 3 phone calls to get my MAC code....!Shame about the above because prior to that I'd always sung their praises! I'd also like to think that it was a one off, but my Mum left them about 3 weeks later and had exactly the same problems!!Get your act together o2 - repeat customers are the way forward!",1
Good service but I ordered an Adroid Ace and it said on the O2 website I could get BBC iPlayer which was actually incorrect.,1
"My review is neutral as there are some good and bad points.I find my O2 signal decent compared with other contracts with THREE and Vodafone. I usually get to chat to someone quite quickly (prior to this Covid19 emergency) and they can mainly solve my issue.I recently upgraded and noticed that a free amazon prime/Disney+ etc was available for free. I upgraded and didn't receive any correspondence. I contacted them to be told that the freebie wasn't available on the tariff I have purchased. As I have other contracts with other providers, I opted for the lowest tariff of unlimited calls and 1gb of data. The phones cost was broken down over the monthly duration then £19 is added for this 1gb tariff. I didn't think too much about it until a month later then have a big advertising campaign promoting SIM only with 50gb of data for £20.O2 claim you only pay the actual handset price but the tariffs are extortionate compared to a plan without a phone. To me, a plan should cost the same regardless of the phone element then the phone is added at the true cost O2 want to charge instead of hiding it behind inflated tarrifs.",1
Good customer service just never take out O2 insurance hard to find there number and impossible to make a claim,1
"Update: 17/08/23, they put my line back in service during the pandemic when I had no phone line. It wasn't kind. They offer a good service, which seems to have improved gradually. 03/01/2021 Poor service; they cut my line during the lockdown, and I had no phone left in case of a life emergency",1
Helpful advice from O2 shop in seeking mobile phone tariff reduction based on review of my usage history.,1
"O2 refresh good, allowed to upgraded 13 months early for free however very poor speeds in my area",1
The contracts are decent and signal is good. The customer service is not reachable though!,1
The signal in my area isn't brilliant although my bill isn't too bad.,1
"Far too quick to get you as a customer, very little service afterwards...",1
Can't wait for my mobile contract to end so I can change supplier,1
not getting the coverage i would like in some areas of hampshire,1
"Why can't it be set up that I get informed/warned if I am about to use a service that I will incur extra charges on my bill?I have just come back from Orlando and have been charged every day I was there. I knew I would be charged for some of the days as we were away from the hotel but I used the internet at the hotel on the days we were there. I had the UBER app so we could arrange for taxis wherever we were, but these have worked out more expensive than the I-RIDE now because of my charges from O2. If I had been paying for my 12 year old daughters phone I would have incurred the charges for this too and that wouldn't have been her fault.My children know when in the UK that if they say there will be a charge for something (I.E.Game or tune download) then they are not to continue. Surely if they can warn you of this then they can warn you if you are subject to be charched if you continue with a certain service abroad. Luckily my 18 year old son has juat put his phone in his own name as I had paid for it for the last 3 years.If any of my children were on my contract and had incurred these charges without being warned I would have refused to pay them and taken it to court. This needs to be addressed so that we can make the choice to continue with or avoid the charges...??I have been with O2 for approx 6 years or more and have always found them good but this recent experience will have me checking out their competitors on my next renewal unless they change it.Originally would have got 4 stars possibly even 5 until this recent rip off scam.!!",1
"Coverages OK, but customer service center could be better.",1
Good network but poor signal in the Birmingham area,1
"This has to be the most frustrating, confusing, overcomplicated and inefficient website I have ever experienced. Every month it's a fight to actually view the bill. When you 'sign in' it constantly kicks you to generic pages about what they do or what you can buy or changing your details, it's a labyrinthine pot luck to view what 'your o2' is actually doing. Eg, viewing a bill or attempting to top up or even attempting to buy anything you've seen on the page before?..... I'm just going to say GOOD LUCK!! The very few times I have ever managed it is by clicking the link on the billing email the very first time I've opened it and that has still usually taken several attempts. Trying to contact them is pointless, I have done so via their 'contact us' link on several occasions and had generic 'click view my bill' etc instructions (like that's not what I'd done in the first place!???) for the first couple of times then absolutely NOTHING! And, before you wonder, I have never been rude or abusive I've just said I've tried that but it's not working can you help further? The people in the shop are lovely but they seem to struggle getting the site to do anything as well! Ironically, the poor site must confuse itself because if I see another 'sorry, we are dead busy, please try later' message I will scream. Luckily I'm ultimately not that fussed as long as I can text, call and receive calls. If I was a serious mobile phone user I would be straight onto switch sites! God knows who they employed to design their website but I would ask for my money back if it was me!!! Blimey!!!!!!......6th April 2023: they have obviously had a massive overhaul. My experience of direct customer service in 2019 was excellent and their access to bills etc is now not a problem so credit where credit is due! Hence 3 stars now instead of one",1
"New phone from O2 using old mobile number.There are are 3 phases to my last experience with O21) The sales transaction went through very smoothly and I received the phone on time as stated. One minor issue with not sending me the new format Micro Sim card, but sent me a free Pay-As-You-Go sim card.2) Upon receipt, called O2 and reported the missing sim card, and that I need my old number managed by O2 to work with the new phone etc. At the time I was still using my 4 year old mobile phone. The assistant took my details, phone details, details of the Pay-as you go sim card and even details of my old phone's sim card.The O2 assistant then went ahead and logged the details and made some changes. Note that my old number is purely used for business support and the account with O2 is also a business account.The following day by sheer coincidence one of the walked in customer informed me that my phone number seems to be cut off!!!!  Only then I realised what the O2's operator had done to my 23 year old business phone number. She changed my old number with the Pay-as-you-go number so my old phone now only works with the PAYG number!!!3) Furiously called O2, a very calm operator took the details investigated what was done and apologetically managed to undo what was done, it did take about an hour before I get my old phone number back and also he arranged for a new sim card to be sent, so the new phone with the new sim card and the old number eventually worked together.In terms of marking:1) Phase-1:       4*       would have been 5 if I had received the Sim card.2) Phase-2:       0*       I am being too generous here3) Phase-3        5*       For fixing the problem so promptly.",1
"Have bought new phone from 02 for my 02 service only contract. What a farce. Had to buy it via taking out other contract and then paying it off. Lad in shop was very precise about what I needed to do and even gave me script. I followed it to the letter luckily and noted down time, name of operative and transaction number. A month later they charged me £600 for not using the contract. I phoned twice to try and get them to repay the amount and eventually had to get my bank to take the money back. Then they took it out again the next month because nobody it seems had made a note of the repayment. I've just had a third call. No manager in the office to speak to. They acknowledge I don't owe them the money but just don't seem to be able to get it together to stop taking it. Have been with them years because their coverage is good but this side of the business is totally chaotic, very badly organised and frankly leaves you feeling they couldn't give a damn.Update: On my bill for December it appears this problem is finally sorted. It took four telephone calls, an email and a visit back to the O2 shop where I bought the phone. One of the problems seems to be their billing service is automated and carries on sending out bills even when they adjust the amount in the account. A second problem is the telephone operatives are not authorised to adjust bills above a certain amount so they have to contact another department to authorise that and a third problem is that the supervisors are not numerous enough to deal with the volume of complaints so are not available to deal with you at the point of contact. To be fair, the humans I came in contact with were uniformly courteous. It appears to be the systems which require a radical rethink.",1
The best service provider but the prices very high.,1
"New contract with slow 4G and 3G speeds.I took out a new contract with the OnePlus 5T handset and had come from the EE network. The O2 network was very slow for 4G and 3G speeds. After I had contacted their customer services, they were unable to tell me why I was receiving slow speeds (2-10mbps) on 4G. I couldn't even load the Google Homepage, I might as well have had an old Nokia as the only thing my handset could do was make and receive phone calls.They allowed me to do one of the following;Send the handset back to them and pay for one months' airtime, ending my contractorPay the handset value off, which then can be unlocked for free and used on another network.I opted for the latter, paid £438, and they unlocked my handset and ended my contract without penalty. I have switched back to EE, and back to the normal 50-60mbps 4G speeds.Their customer service team, particularly the technical support team aren't very good they told me that their phone masts were working correctly and that the network might be ""busy"" and when I complained regarding the slow speeds they made no effort to retain me as a customer and the retentions team processed my cancelation within minutes. Maybe they are aware of the slow speeds?To me, 4G speeds should be at a minimum of 30mbps, and just like home broadband packages now they should be regulated with a minimum guaranteed speed at your home address. I was lucky in this instance that O2 allow you to pay off your device and leave, but if it was over the 14 day cooling off period and I was with another provider then I would have been stuck in a 24 month contract with slow speeds. Hats off to O2 for resolving my issue and allowing me to leave my contract, I would return as a customer if they sort out the speed of their 4G services.",1
"I don't know where to start. We've seen the worst possible customer service with over 8 hours on the phone to O2 in more than 30 calls. Please read this is you ever have problems reactivating your phone after reporting lost temporarily to O2.  They couldn't reverse the blocks they put on our phones.  It ended well in the end with 2 new phones provided free of charge - which is why the 3 star rating.- Loss of phone for a few hours result in device blacklisted.- Phone found shortly after. After 8 days and 8 hours of calls O2 still couldn't reverse what they had done to the phone even after removing the blacklist. As a result no signal, calls, imessage etc... the phone could only be used on WIFI.- To make worse O2 asked the sim to be put in someone else's phone to see if it worked. Doing this blacklisted their phone too and again when O2 reversed the process their Iphone was left unusable except via WIFI. Their phone was not on O2.- After much wrangling and refusals, O2 replaced the O2 contract handset with a new one via next day delivery but denied any responsibility for the £1,100 + non O2 Iphone 12 Pro they had made unusable. Attempts were made to blame Apple and the carrier the phone was actually on.- We logged all calls (time, date, content etc..) ready to go to small claims court or ombudsman. The formal complaint process was initiated via email. An email was sent to the CEO (and a response from his team received within 24 hours), social media used and info sent a newspaper consumer champion.- Finally on the evening of 31st Jan we received a call from someone senior, professional and clued-up who wanted to help. After sending screen shots directly whilst on the call via email to them, a new un-locked Iphone 12 Pro at zero cost was promised via next day delivery.  The old phone will be returned in due course as part of the process.This non-O2 new replacement phone has just arrived as promised and with my old sim card I finally have a signal and working phone back. Thank you to who eventually sorted it out.",1
"I decided to move from SIM-ONLY to o2 Refresh, because o2 was doing a buy 30GB for the price of 10GB deal.Speaking to the agent was great. She was very helpful, polite and sorted out my package quickly.Rather than have it sent via post, I decided to collect from my local store in WEMBLEY CENTRAL.After carefully reading the instructions on the email, I went to the shop with Order number and the Debit card used to make the transaction.Once I got there, I showed my Order number, then was asked for my Debit card. I was asked a few security questions, then I was asked to supply photo ID.At this point I informed them that the email from o2 said NOTHING about photo ID. I brought what I was asked to bring in the EMAIL. The AGENT who sold me the phone also told me to bring these things and nothing else.I was then told there was nothing they could do and I would have to go get photo ID.I had a friendly back and forth with them, informing them that their shop and o2 need to get on the same page. o2 is telling me one thing...... You guys are telling me something else.I also informed the GUY that I was dealing with there, that I also have experience dealing in Customer Service, and this isnt the correct way to handle this situation.HIS response was, ""Well if you have experience in Customer Service, YOU should know better""......... LOL ........At this moment, I fully understood why O2 has such Low ratings.I went home, got my ID and brought up my email on the phone. Showed it to the staff and asked them to read it out to me. They quickly realised they were wrong and apologised....... BUT... damage was already done.They explained that their store is a Franchise etc etc etc, thats why they are more strict with security...... not sure why a customer needs to know thisIn the end, I dont fault them to much. O2 need to train their staff.But they also need to recognise that these kids represent their company and brand",1
PASYG cheap but coverage only fair,1
"A mixed customer experience made at last satisfactory.A few years back, I took out a dongle mobile broadband account with O2 which I used infrequently to use during outside broadcasts for a Gospel Radio Station.Last November 2017, I asked O2 to discontinue this as I was personally paying for as a gift to the charity and use had dwindled down to 0 use.I was assured by helpful phone staff that this would go through in the next few days and to ignore any bills.  The account was to have been put on a PAYG basis.  A bill came in December then January.  I followed this up.  The helpful staff assured me there had been an issue and applied credit to cover the bill. Good...Then a bill for £.00 came in February.  My THought - What are O2 doing wasting money of course the account is cleared and PAYG.A bill of disconnection came in March for £19.08.  What?  How can you have £0.00 one month then £19.08 the next?  What are O2 playing at? A call to the friendly apologetic Samantha reulted in no answers as she could not get into the system with the info I had given.  She suggested I try an 02 store with the device.I did so today but the staff there were unable to directly help short of giving me a phone to call. The helpful Jen offered to sit with me while I called and she did until I was able to speak to someone.   38min and 6 seconds later - I think a result.Most of the time was spent waiting while David and his colleague did their best to clarify the situation then arrange to apply a credit to cover the full cost of charges up to 10 March.It is a mark of a very good company to admit when they are wrong.  This David and his colleagues have done and have tried to make good.  Hats off to the individuals in O2 who try to make good. They should be appauded.It is a mark of a very poor company when the accounting system lets its employees down and does not apply the changes customers ask for and are promised and sends wasteful, spurious bills.  If I am annoyed and inconvenienced think of the effect on those less able to pay their bills and those vulnerable.If O2 truly have made good and short of the final statement, I do not receive another bill, all well and good.  If not, watch this space.  I won't hold my breath.",1
Solid but evil on pricing,1
Ripped me off,1
never used,1
Been with O2 for 7-8 years and I can say they have fallen from grace there signal quality is very poor cant get reception in my own home now when once they where the only company that could and the prices of contracts compared to what you get is terrible my girlfriend changed hers when she got an iPhone and they told her she want this contract then cos her old one was to much she then run up a £60 just a scam to get her of her old decent contract.,1
"I walked out of my local O2 shop when they said quote ""yeah we are expensive and the trade in is pants - but hey we can sell as many as we like (4S)""....so I went to Vodaphone and they had a really good deal but no phones..so went back to 02. No joy, no price match not even for a long term customer with 4 phones in the family...so went back to Vodaphone. They suggested I called O2 retention !!!!!! I did - they did a great deal...BUT. When the new 4S stops working the customer service refer you to an O2 shop - who will have nothing to do with you. As neither will Apple. Buying from 'retention' is deemed to be online and nothing to do with O2 retail shops.  Poor service, wrong customer service advice - shame about the phone. Only saving grace was excellent support from repairs team - but it took me 3 hrs and 5 calls waiting on piped music landlines.",1
"Edit: Dropped to three stars as I dropped O2 when their signal in my town went through the floor after some 'consolidation' of masts.O2 aren't perfect, no telecoms provider is, but after dealing with all of the 'big 4' top tier mobile telecoms companies at one time or another O2 comes out on top by a long chalk in terms of the coverage they provide (both 2G and 3G), the value of their products and contracts, and the customer service they provide when needed.They could certainly improve in all three areas, and particularly in customer service, but I would rate them as 'acceptable' or higher in all three areas, something I couldn't say for Vodafone, Orange / T-Mobile, or 3 and certainly wouldn't say for ANY of the 'virtual' providers such as Virgin / Tesco etc.",1
"have been an o2 customer for the last 4 years before that I was T-Mobile, changed whe I was assured that the reception would be much better than with T-Mobile, when?",1
"02 seem to faver the pay as u go customers over the contract customers,  (ie) free this free that but if your on contract zilch.",1
"Good, but i'm jealous of the movie deals from orange at the moment",1
Caravanning round the UK I was looking for a network that supported iPhone & gave good service. O2 has done this though I am surprised with the various 'blackspots' in coverage in Scotland & middle England compared to my wife who's phone is Orange. Quality/depth of service is certainly better than hers when we both have signal but she has signal more often than I,1
"always good service from customer service department, website really hard to use when trying to add/remove contact details on family bolt on - so would say website needs looking at by IT department. only let down is when someone at customer services say they'll call you back then don't",1
