"Credit where credit is due 02 are actually doing something about the issues with the handset and all is getting sorted thanks you 02And yet another 5 hours and 20 minutes over two days of time to 02 customer service with no help. My problem is I have missed my bill this month but 02 cannot do anything about it ok it's my fault for missing the payment all I asked for was a extension of time in which I got refused.........I have been suffering with 02 no service for just over 6 months due to masts being down as they informed me there is nothing that they can do because it's in my small print in a contract I signed.It basically started that if 02 are down it's my problem because they don't actually have to provide a service lol but I pay for a service, that I'm not actually receiving. I asked for a extension of time (as I have bared with them) to make the payment but no they are unable to help.Anyone who is reading this please do research and go with a better network provider if you fall in the same category as me they won't help you with a service or help with payment.",1
"I have had the same mobile number since 1994, I have been an O2 customer since it was BT Cellnet (Yes, I am that old). They really need to do better at customer relations, they are abysmal, and now, 5G, what a joke that is, I have had to restrict my phone to 4G to ensure a signal, on 5G is is like using dial up modems again. I was once an engineer working on the O2 cell towers, they used to have a decent power output - they don't now, of all the cell providers in the UK, their towers have the lowest output of the lot - and that is purely to save money on electricity costs, certianly not provide an adequate service for customers - and I use the adjective Adequate advisadly...I cannot, in all conscience recommend them, and when my contract is up I will finally transfer to a new provider - I haven't until now through laziness on my part, but enough is enough.",1
"My phone was stolen on Monday and O2 immediately blocked my number which was amazing. Thank you O2 for working so quickly.I went into store to get a new sim but since I’m on my Dad’s plan for multi sim discount, I wasn’t allowed to do ANYTHING, despite my name being attached to my number and since my dad is in a different city, I travelled there to go into a store to get my sim. Unfortunately they didn’t check whether my number had been blocked in store and it turns out my number had been double barred (whatever that means) which meant I will not have had a connection to the O2 network for nearly 48 hours instead of the usual 24 hours. The customer service assistant did apologise for this, which I appreciate but it would have been so much easier if O2 would allow authorised contacts instead of only talking to the account holder because I would have been able to solve it much, much earlier and also get my sim earlier.Please O2, allow authorised contacts so that this doesn’t inconvenience people in the future.",1
"The performance of O2 SIM's card varies - some days it works well, while other days it doesn't work as well.",1
"O2 the guys in your shops are fantastic but sadly I can’t get onto the shop when I’m working so sadly have to call customer services. Please please please O2 start employing some English speaking staff, the last three times I have had to call you guys I have had to repeat myself over and over again it’s sooooo frustrating and must be hard for the call centre guys too, I also don’t have time to spend half an hour on the phone for something that should be done in 5 minutes without the language barrier… honestly really thinking of getting rid of O2",1
"O2 can either be very good or very poor. For example they sent me a phone case I didn't order and charged me for it.It really depends on the advisor, some are very knowledgeable and helpful. While some are not.",1
Im not happy with the ssrvice 02 provides i never have any signal it doesnt matter where i am i have never got beyond a joke as my job consists of traveling alot and i live in a city!,1
"I upgraded to the z fold 3 don't get me wrong it came after being delivered to a different address. Quite disappointed that it didn't come with a plug since the charger isn't a USB end, no screen protectors, no headphones when you buy cheaper phones you get the lot so why not the same with the newer phones. It definitely should come with at least a plug for the charger.",1
"The prices are cheap, but the quality and speed are terrible. You get what you pay for..",1
"I’ve been saddled with O2 by Virgin. Out of the 3 mobile numbers registered on Virgin Family plan 1 number was transferred to O2 and is visible on MyO2 app and the other 2 numbers were transferred to O2 but are parked somewhere on the system. I have no access to them via O2 app and so can’t manage spend, allowances etc. but O2 are still dutifully charging me for them. After about 6 months of on-off chasing O2 unsuccessfully to merge 3 numbers on my account I got fed up and told them to stuff it. The customer service was 50/50, some tried to help but had no idea how, others were incompetent and rude. Then I discovered that Virgin tied me into O2 via their Volt package and if I ditch O2 then my Virgin broadband doubles in price. After another few hours of my life on the phone to Virgin and O2 that I’ll never get back Virgin told me they managed to remove O2 ‘benefit’ from my Volt package and keep my discount and I can now cancel O2. Virgin phoned O2 themselves and then transferred me through to get PAC codes for the 3 numbers I wanted to move out of O2. This time I finally got through to somebody with brains in the UK call center. They explained how to set up alternative account for my other 2 numbers and couldn’t have been more helpful and knowledgeable and managed to persuade me to stay with O2 for another 12 months by taking a third off my bill.  Maybe Virgin have access to better level of O2 customer service because whenever I phoned O2 directly I ended up speaking to somebody in overseas call centers with poor English and wrong attitude.Anyway, my overall rating is 3 stars: I did get what I wanted (access to other 2 numbers and reduced contract cost) but customer service is very poor and transfer from Virgin to O2 was crap.",1
"My overall experience with O2 has been mixed. There is no other way to describe it.Let's start off with the positives.I have what I would call an unbeatable deal from O2 thanks to the Virgin Mobile migration. My phone bill is £6.79/mo for completely unlimited data (on VM, it was for 2GB, plan price was originally 2GB for a 12 month contract in 08/2018), which no other network would ever be able to beat. I currently use around 40GB in a month, which is a stark contrast to never using over 4GB in a month for 5 years. Granted my usage habits have changed now that I'm free to burn my data.Through the Virgin Mobile migration, I also gained the ability to use 4G calling and WiFi calling (yes Virgin did have the ability for both, but it just would have been a pain to set up) from the moment I migrated. Unfortunately, these features did disappear for a long time (from about July to mid-December) which sucks. I don't make calls often but both options make calls crystal clear and reliable.A bit after mid-November, I decided to get a SIM swap with O2, since I was still using my old Virgin SIM (which was originally programmed to connect to the EE network, still have remnants of that even with my new O2 SIM with the T-Mobile MNC seemingly reporting ""Virgin Mobile"" when manually searching for networks). The SIM swap processed extremely quickly with being delivered within just 2 days (one day after my order confirmation), which was a stark contrast from the experience that I had with moving someone from Plusnet to EE (SIM took 4 days to deliver and EE didn't even send confirmation details).Priority is a cool plus to have and getting Volt features is nice too.Now the negatives.With the migration, I was promised the visual voicemail feature on my Android phone, but it has yet to work for me. I've had a tab for it appear once, but that's it.On Virgin, RCS always worked perfectly fine. Meanwhile on O2, I've had a few problems (particularly by the migration from O2's RCS to Jibe RCS) and it's left me unable to use RCS.I'd like to finally end this off with a concern I have for the future as an O2 customer. Due to the way that O2 migrated Virgin customers, my tariff price is £13.29 with a £6.50 discount bolt-on. I am concerned that the annual price increases will cost more on O2 than it would of on Virgin due to the way that the migration was handled.",1
Too expensive but stuck with them since they took over from Virgin mobile,1
Decent network been with them years. Never had any major issues,1
Moved from Vodafone hoping for better network.Absolutely rubbish! Do better O2,1
"I don't really have any issues with O2, have been a customer for many years, I do however think they can improve by using another delivery company instead of DHL Parcels UK, I was offered next day delivery by O2 for my upgrade. Still no sign, should of been delivered 31/10/22. Seems I'm not the only one having problems. O2 needs to get a reliable delivery company not fraudsters.",1
"As of the time of writing this review, one of our contracts has been canceled, and we're hoping it stays that way. Prior to this, my family had three contracts: one for myself, one for my dad, and one for my little brother. My dad and I had a generally positive experience with our contracts, with only occasional internet signal issues, which were infrequent and didn't significantly affect our overall satisfaction.Now, let's delve into the canceled contract concerning my little brother. Approximately two months ago, he temporarily lost his phone, but he managed to retrieve it the following day. On the day the phone was lost, we promptly contacted the service provider to report it and have the number barred. We were informed that we'd need to wait for 24 hours for the bar to be lifted, which we accepted. However, for the following three days, my brother couldn't make calls or use data. We reached out to customer support, only to be advised that switching SIM cards would be quicker. We visited the first store in Wembley, but my brother failed to answer the security questions and lacked the required identification, which, understandably, the store couldn't overlook.We then tried another store in Edgware while I was taking care of my car. We brought two forms of ID and proof of billing, and requested a new SIM card. However, we faced the same issue with security questions and ID verification. The system seemed to have a glitch in specifying which security question to answer. We contacted the service provider, and it turned out that my brother had two security questions and answers, and the system wasn't clear on which one to use. Despite answering correctly, the issue persisted.After trying to resolve the problem for several days, including obtaining multiple SIM cards and switching to different phones, we realized the problem wasn't with the SIM but likely linked to my brother's account. The service provider promised to investigate, but after a week, they requested another week to continue their inquiry. Keep in mind that we made repeated calls during this process, and sometimes the support team didn't have the necessary information, forcing us to provide it repeatedly.After waiting for over a month and a half with no resolution in sight, we decided to cancel the contract. Fortunately, we were given credit, so we didn't have to pay, but it became apparent that having a contract was pointless if we couldn't use the SIM. Interestingly, we switched to Giffgaff, which operates on the same network as our previous provider (O2), using the PAC code for our number, and everything worked perfectly. As such, I don't expect a cancellation bill, as I left the contract due to the absence of service, which should be evident in their records. It appears that my account was disabled at the time of writing this review.",1
Transferred over from virgin to o2 definitely an improvement over virgin mobile network has a smoother experience coverage is great at my home very poor at my work but this service is very cheap compared to the competitors seems to be better than my experience with o2 two years ago,1
O2used to be good until thay merged with virgin media,1
"I have changed the provider for 02, not quit what I expected ...",1
Good service all round. But I think advisors need to explain certain terms of deals such as O2 Switch Up. The problem is it’s being advertised as upgrade your phone whenever you want from the day you to take the contract. But actually it’s after 14 days of purchase. Falsely advertised.,1
"Customer for 5+ years and the experience goes down every time I roll off a contract. Coverage and features of the service, generally very good. Customer service and the transparency of billing and switching, terrible. Really struggle to get the best deal, and billing transparency is next to nothing when there's a change - email updates do tell you what it's going to be, but not why (or even if) there's a change.",1
Mobile phone providers are all pants lets face it however O2 have impressed me by now auto moving you to SIM only once handset is paid off not like the rest who just take the extra profit until you realise or pushing upgrade onto you - reception could be better!,1
The service in the cinema for popcorn and drinks is abysmal. 10 mins per customer. Never seen anything like it,1
"I have been a loyal 02 custome for over ten years. Yesterday I wanted an additional contract for my 14yrs old son. I spoke to a gentleman called Tom. He was very helpful and professional. As we were about to complete the deal the system went down and he could not proceed. He apologised and kindly asked me to call back today. I called back this morning. I was holding on for over 30 minutes just to speak to someone who was inpatient, not will to help and would not give consideration to the conversation I had with her colleague the previous day. So I had to choice but to contact another provider for a new contract for my son. I'm really disappointed and would not be renewing my contract with 02 when it expires",1
Download speed is mostly ok but upload speed is useless max I have seen is between a shocking 0.1mbps to Max of 10mbps sure this service is cheaper than Vodafone and EE but have to remember that you get what you pay for customer service not good either you will be waiting over 30 minutes to speak with someone and there is no function like Vodafone to receive your call back in turn I have just moved to this network it is cheaper but service is so so,1
"Website is awful. PAYG top up won't allow you to paste a credit card number in, then moans you have typed the number in wrong. Wouldn't be an issue if you would allow the number to be pasted in!Then there is no way of contacting them to provide feedback on this, even the complaints service is hidden behind some live chat thing, just want an email address at least. Not hard really.The irony of this review is the notification box at the bottom is the only place I have spotted an email address for O2!",1
"Been with O2 for about 10 years and honestly they're average as far as phone networks go, like I've never actually had much issue with the network itself but I will say if you go anywhere out of London your signal will defo suffer as oppose to being inside of London. I'm planning on leaving O2 soon not for the network coverage but the price of paying off a phone, my family have always been with O2 and me and my dad have always gotten our phones from O2 but as I've gotten older I've realised how much you overpay, and it stems mostly from paying your for your phone over a long period, I currently have an IPhone 12 and got it from O2 and honestly really regret it. The problem with paying off Phones is the fact that they go down in value from year to year, so I've now given O2 around 600+ pounds for a phone in present day it's worth about 200, used which is insane, obviously tech does do go down in value as it gets older but wow a 400 pound loss is very bad especially cause eventually I am planning on selling it and buying a newer phone, there's also the sim costs which are completely overpriced and stupid O2 seems to have a minimum that they want you to pay cause in some cases 8gb of mobile data will be the same as 4gb in price and will go down very little in value which isn't good if your attempting to save money by cutting off data that's not in use, there's also no incentive anymore for me to stay on the same network as my family or people I talk to as lowered pricing for texting and calling for people on the same network really don't exist anymore as most people are on unlimited contracts as it's literally cheaper. I'm mostly likely going to be switching to a lesser known network which picky backs off of the Three network like Smarty or Honest Mobile due to their less expensive and non contract nature and saying goodbye to O2 cause it's wayyy to expensive to justify using. Thanks.",1
I had £10 PAYG bundle and I think o2 a very good reliable network but have they still got that really silly voice message at the start of every call you make that says 'BUNDLE CALL' nobody's going to want to hear that when using phone. This has gone on for years and no other network payg make you go through this annoying garbage. Grow up o2. Unless they do it to force you to get sim only contract. Will be going vodafone with no silly messages before voice call.,1
Been with these guys for a third of my life and they have been top notch for years. I have had issues with them every so often but never like this one recently which has made them loose two stars. I had issues with my signal as a mast went down near by and it took them over a month to sort it out. My work was heavily affected by this and I never got any compensation from them. As a loyal customer I expected better service...,1
"I rarely feel motivated to review a company that is neither wonderful or dreadful, so my reviews tend to be all or nothing.  Here's is a company I really have no strong feelings about.  It's reasonably cheap, the calls work fine, and there are rarely outages, but the website is a pain in the behind.  I can't honestly recommend them, but nor can I be bothered to leave them.",1
"I suffered  a delay for the transfer of my previous phone number to the O2 SIM.   The online support was not at all useful but when I was eventually able to talk to an O2 human, she was polite, efficient and helpful.O2 owners and managers should not believe that their IT systems will ever be as good for their customers as  a human agent.   Only the simple queries can be properly dealt with via their support line.",1
"4G signal is terrible considering that they have low bands, 3G signal is great but when you're getting 1.4Mbps down and 0.6Mbps up its pretty useless and even when 4G signal is good the best I get is 5.7Mbps down and 0.1Mbps up. Avoid. I left Three for these and shouldn't have bothered.Now down to one star, numerous reports about the network issues, many texts saying work is happening in the area only to find no improvements what so ever.Offered a reduced package which I am happy with (less data), since now I've taken out broadband. Customer service on this occasion was actually spectacular!",1
"Overall Average, their contracts are sometimes a little expensive for what you get, live chat experts half the time can’t answer your question which slows things down, Connectivity is average not the fastest speeds slow at times. Just a very basic and average experience overall. Not sure if I’d recommend O2.",1
"I got lucky on 2nd attempt and the lady was very very professional. But the first person was an animal. As a NHS worker feeling the strain I understand why, but that doesn't make it acceptable. I have spent several years in NHS and also in the Financial sector prior to that and treat people as I wanted to be treated. So o2 either you working your staff to hard and need to sort your capacity or you need to give some vial people the boot",1
"My husband needed a new phone, so went to Worthing O2 shop. Service couldn’t have been better (5 stars for them!!) , in that they were really busy, so very nice guy in there took phone number and said that he would ring when an advisor was free, to save hanging around in the shop. We were then dealt with by Victoria, who could not have been nicer or more helpful. HOWEVER - I then tried to contact O2 Customer Services to compliment the Worthing shop. Ended up completely defeated by impenetrable system (NO stars for them!!) - maybe I won’t change my phone to O2 after all…..",1
"I've been a SIM-only customer for a year, which I got at a fairly good price (20GB for £21). It's a good price (considering it's O2), but the coverage is not what I remember of O2 to have before. It's been pretty disappointing, especially when commuting, and making me consider switching to other providers when my contract is up.",1
"Called up to cancel an airtime plan which I no longer had a use for. Initially I was advised that I could not pass security and therefore could not cancel this, I then spoke with someone else, went through security fine (my answers had not changed) and have managed to get the matter resolved. I really do wonder what nincompoops get employed here at times!",1
I’ve always been a bit of a fan of the O2 but when they tried to Renew my car insurance with a card which was obviously out of date and then charge me £20 to renew it I think this is less than business like they have charged me now the £20 saying it was my fault that I didn’t give them an update on the card,1
I have recently left O2 having been with them for a good few years.It has been noticeable that whilst away from the home the service has been poor with O2 having no connection whilst my family who use other providers have had a signal.Although the coverage was poor I have to say that customer service was excellent every time I contacted them.,1
"Moved from EE and had nothing but hassle from day one, luckily still within 14 day cancellation period and it's headed that way. Feels like they want to blame customers for issues and once signed up are no longer interested in you.i have given 2 stars as expecting a call today to get resolution but it should be one or less,doubt it will happen and if not I will be returning their phone and cancelling my contract...O2 came back and resolved the issue, was just a bad store experience.",1
Ordered a Samsung Gear VR from the o2 shop. The check out was very painful and i had to key details multiple times before it eventually went through. If another supplier had of had stock i would gone elsewhere. Pre sale experience 1 Star.Item however arrived next day with a fully tracked service and the after purchase experience was 5 star so overall 3 stars from me.,1
"I""ve found that  when I contact O2   via the phone usually good service, but go to a branch and you""re lucky to find someone who knows what they""re talking about.Had a terrible experience at Brentwood where the assistant suddenly ran off with my debit card and made a copy of it--I managed to get photocopy destroyed. All she kept asking me was I happy with the ""service""!!! she gave.  NO I WASN""T.",1
"Ok customer service used to be soo much better. Certainly better than the other competitors. I have had a contract with these guys for over 15 years now. They used to be so good in retaining customers, however lately I don't think they care anymore. They are definitely the most expensive network out there. I would recommend go via carphone warehouse if you want an O2 upgrade or contract. The same tariff at carphone for O2 will be cheaper than actually going direct with O2. I know you'd think it would be the opposite.",1
"I've been with O2 10+ years and have an iPhone with them, so far so good in most respects. Apart from one, and it's so bizarre I find it almost unforgiveable for a mobile company. They text you your bill and in the text is a web address to manage your account. Click on that link though, and you go through to a site optimised for desktop users only. Not mobile users. Um what does this company do again:)?",1
Been with O2 (and previously BT Cellnet) for over 10 years now. Signal is always very good but recently the cost of being with this network vs other is terrible. I have NEVER been rewarded for contract renewals and by renewing an iPhone contract with them as opposed to moving network I am actually WORSE off.When phoning problems I get transferred from here to there and spend hours holding. Disappointing.,1
"Even after the cost of the 'free phones' was covered, they kept taking those rentals for year after year, without ever once informing me that, maybe, just maybe, I was not getting a fair bill for the one or two calls that I made per month. Just kept on taking the money.That is, until I wised up. And I would probably slill be  paying, except that they got greedy!!!!!!",1
"Variable service, not the phones but the company.  Sme issues sorted out really quickly, some things can take months.  I have a £10/month contract with mins, free texts and a good phone, which is well cheap.  Broadband and webmail problems have taken a very long time to sort out in the past though.  In short a good value product as well as you dont get faults.",1
